date,title,event_type,counterparty,amount,source,url
Unknown,BlackRock Host Investor Day 2025,,,,Google News,
Unknown,BlackRock to Acquire ElmTree Funds,,,,Google News,
Unknown,LendingClub and BlackRock Partner on Loan Transactions Up to $1 Billion,,,,Google News,
Unknown,BlackRock Income Trust (BKT) Provides Update on its Discount Management Program,,,,Google News,
Unknown,BlackRock removed from Texas divestment list after climate alliance exits,,,,Google News,
Unknown,Consortium completes acquisition of Viridium,,,,Google News,
Unknown,"Joseph Chalom, former Head of Digital Assets Strategy BlackRock, joins SharpLink as Co-CEO",,,,Google News,
Unknown,American BlackRock acquires energy company Allete for $6 billion,,,,Google News,
Unknown,Archer Raises $300M From Leading Institutional Investors To Accelerate Hybrid Aircraft Platform Development As Defense Opportunities Look Stronger Than Expected,,,,Google News,
Unknown,Georgia workforce training gets $1M from BlackRock Foundation,,,,Google News,
Unknown,BlackRock® Canada Announces July Cash Distributions for the iShares® ETFs,,,,Google News,
Unknown,BlackRock strikes $23 billion deal to place Panama Canal ports under American control,,,,Google News,
Unknown,Ray A. Cameron Lauded for Significant Contributions in Financial Services,,,,Google News,
Unknown,BlackRock’s Custom Glidepath to Power Great Gray Trust Company’s New Target Date Retirement Solution with Access to Private Markets,,,,Google News,
Unknown,Consortium of top-tier insurers and asset managers to acquire leading European life insurance consolidator Viridium,,,,Google News,
Unknown,BlackRock Completes Acquisition of HPS Investment Partners,,,,Google News,
Unknown,BlackRock Debuts Active ETFs from its Global Allocation Franchise,,,,Google News,
Unknown,"BlackRock Launches Texas ETF, Opens Greater Access to Invest in Growing Texas Economy",,,,Google News,
Unknown,"Certain BlackRock Funds (BGY, BSTZ, MVF) Announce Expiration and Preliminary Results of Tender Offers",,,,Google News,
Unknown,"BlackRock Announces Closing of Reorganization of BlackRock Enhanced Government Fund, Inc. (EGF) with and into BlackRock Income Trust, Inc. (BKT)",,,,Google News,
Unknown,BlackRock Expands iShares Build ETF Toolkit with Industry’s First S&P 500 3%-Capped Weighted ETF,,,,Google News,
Unknown,BlackRock® Canada Announces May Cash Distributions for the iShares® ETFs,,,,Google News,
Unknown,White & Case advises BlackRock on Seven2’s acquisition of Fulgard,,,,Google News,
Unknown,"BlackRock Municipal Income Fund, Inc. (MUI) Declares Final Distribution as Part of its Conversion to the Institutional Share Class (MUNEX) of BlackRock Municipal Credit Alpha Portfolio, Inc.",,,,Google News,
Unknown,BlackRock Exit: Net Zero Asset Managers Suspends Activities,,,,Google News,
Unknown,Press Release: Distribution Dates and Amounts Announced for Certain BlackRock Closed-End Funds,,,,Google News,
Unknown,BlackRock’s LifePath Paycheck™ Closes 2024 with $16B in AUM,,,,Google News,
Unknown,2025 Q4 Investment Outlook | BlackRock Investment Institute,,,,Google News,
Unknown,BlackRock Completes Acquisition of Global Infrastructure Partners,,,,Google News,
Unknown,"BlackRock to Acquire Preqin, Leading Private Markets Data Solutions Provider",,,,Google News,
Unknown,BlackRock Announces Board Approval of Closed-End Fund Reorganizations,,,,Google News,
Unknown,FERC approval of BlackRock GIP acquisition threatens fair energy market,,,,Google News,
Unknown,Vanguard Announces Appointment of Salim Ramji as New CEO,,,,Google News,
Unknown,"BlackRock Launches Its First Tokenized Fund, BUIDL, on the Ethereum Network",,,,Google News,
Unknown,BlackRock Reports Second Quarter 2025 Earnings,,,,Google News,
Unknown,BlackRock Announces Updated Distribution Pay Dates for its Municipal Closed-End Funds,,,,Google News,
Unknown,"""Unconscionable to Profit From Fueling China's Military"" - Select Committee Launches Investigation Into BlackRock & MSCI",,,,Google News,
Unknown,"Transparency notification BlackRock, Inc.",,,,Google News,
Unknown,"BlackRock Goes Live with First-of-its-Kind Public-Private Model Portfolios, Enabling Easier Access to Private Markets",,,,Google News,
Unknown,"Jio BlackRock closes maiden NFO with Rs 17,800 crore across three MF schemes",,,,Google News,
Unknown,PRESS RELEASE: Docs reveal Oklahoma AG Gentner Drummond’s secret ties to BlackRock,,,,Google News,
Unknown,BlackRock to Acquire HPS Investment Partners to Deliver Integrated Solutions Across Public and Private Markets,,,,Google News,
Unknown,"BlackRock MuniVest Fund, Inc. (MVF) Announces Tender Offer in Conjunction with Results of the Quarterly Measurement Period of its Discount Management Program",,,,Google News,
Unknown,OECD Complaint Against BlackRock,,,,Google News,
Unknown,"New BlackRock Survey Shows One Third of Americans Have No Retirement Savings as BlackRock, Bipartisan Policy Center Launch National Retirement Summit in D.C.",,,,Google News,
Unknown,"BlackRock, Microsoft, others form AI and energy infrastructure investment partnership",,,,Google News,
Unknown,Securitize announces $47 Million Strategic Funding Round led by BlackRock,,,,Google News,
Unknown,BlackRock in Europe,,,,Google News,
Unknown,BlackRock Event Driven Equity Profits from Corporate Change,,,,Google News,
Unknown,Intesa Sanpaolo: agreement with blackrock to develop digital wealth management in europe,,,,Google News,
Unknown,White & Case advises Blackrock on acquisition of MTW Holding,,,,Google News,
Unknown,"BlackRock Municipal Income Fund, Inc. (MUI) Announces Tender Offer in Conjunction with Conversion to an Unlisted Closed-End Interval Fund Structure",,,,Google News,
Unknown,BlackRock® Canada Announces August Cash Distributions for the iShares® ETFs,,,,Google News,
Unknown,"BlackRock buys Global Infrastructure Partners, makes $12.5B bet on infrastructure market",,,,Google News,
Unknown,Tether Takes Strategic Stake in Leading Brain-Computer-Interface Company Blackrock Neurotech,,,,Google News,
Unknown,BlackRock Announces Expected Closing Date for Acquisition of Global Infrastructure Partners,,,,Google News,
Unknown,BlackRock and J.P. Morgan Back Wealth Management Solutions Provider Dynasty,,,,Google News,
Unknown,Our investment to accelerate clean energy in Asia Pacific,,,,Google News,
Unknown,BlackRock Invests in Small Business 401(k) Provider Human Interest,,,,Google News,
Unknown,BlackRock TCP Capital Corp. and BlackRock Capital Investment Corporation Announce Merger Agreement,,,,Google News,
Unknown,BlackRock Establishes Corporate Foundation,,,,Google News,
Unknown,Deepening Our Partnership with BlackRock,,,,Google News,
Unknown,BlackRock’s Rieder Launches Second ETF After $400 Million Debut,,,,Google News,
Unknown,BlackRock teams with Warner to launch new $750m music-buying fund via Influence Media,,,,Google News,
Unknown,Preqin CEO Gives Cash to Employees After Selling Company to BlackRock,,,,Google News,
Unknown,"SOLARIA ENERGÍA Y MEDIO AMBIENTE, S.A. NOTIFIES THROUGH A JOINT PRESS RELEASE THAT BLACKROCK REAL ASSETS IS THE INTERNATIONAL INSTITUTIONAL INVESTOR THAT FULLY ACQUIRED THE PROJECT BOND NAMED “SENIOR S",,,,Google News,
Unknown,Telecom and tech M&A tracker — Greenlight buys FastBridge Fiber,,,,Google News,
Unknown,Tether Buys $200M Majority Stake in Brain-Computer Interface Company Blackrock Neurotech,,,,Google News,
Unknown,White & Case Advises Brite Energy Partners on US$100 million Investment from BlackRock to Expand Solar Capabilities,,,,Google News,
Unknown,"Prime Broker Hidden Road Adds Major Crypto Exchanges, Expands Use of BlackRock’s BUIDL Token",,,,Google News,
Unknown,Environmental 360 Solutions Inc. Announces Closing of Acquisition by BlackRock Alternatives,,,,Google News,
Unknown,BlackRock could make 110% profit out of Zambia’s debt crisis,,,,Google News,
Unknown,BlackRock LTPC Makes Strategic Investment in ABG,,,,Google News,
Unknown,Greenpeace calls for caution over BlackRock investment in NZ electricity generation,,,,Google News,
Unknown,"US financial giants boost UK investments and jobs across London, Edinburgh, Belfast and Manchester",,,,Google News,
Unknown,Brand & Business: Allianz PNB Life launches the Global Real Assets Dividend Paying Fund,,,,Google News,
